{
  "$schema": "https://ramen-schema.org/model/1.0.0/schema.json",
  "$id": "https://example.com/",
  "id": "ORlgn98lkIzh5cIb",
  "version": "1.0.0",
  "kind": "Model",
  "name": "Simple Example",
  "imports": [
    {
      "modelUri": "https://ramen-schema.org/ramen/1.0.0/model.json",
      "modelId": "lW611f30a2ky4276g3l8N",
      "name": "RAMEN",
      "version": "1.0.0"
    }
  ],
  "classifiers": [
    {
      "kind": "Node",
      "id": "k1nsqV4EImkrzZ2j",
      "name": "Letter",
      "superTypes": ["lW611f30a2ky4276g3l8N:aP3xK8nV1qR6tY2uZ9wB"],
      "attributes": [],
      "constraints": [],
      "ext": {}
    },
    {
      "kind": "Node",
      "id": "Seg0cKcMGCKmCll1",
      "name": "Corpus",
      "superTypes": ["lW611f30a2ky4276g3l8N:aP3xK8nV1qR6tY2uZ9wB"],
      "attributes": [],
      "constraints": [],
      "ext": {}
    },
    {
      "kind": "Node",
      "id": "qR7aST8pHEnrnUWu",
      "name": "Annotation",
      "superTypes": ["lW611f30a2ky4276g3l8N:m2Xv8qL0sP6tN1yK7rB3"],
      "attributes": [
        {
          "name": "startIndex",
          "typeId": "Integer",
          "bounds": {
            "lowerBound": 1,
            "upperBound": 1
          },
          "isKey": false,
          "isReadOnly": false,
          "isUnique": false,
          "isOrdered": false,
          "constraints": [],
          "ext": {},
          "id": "350e33bb596f46a3"
        },
        {
          "name": "endIndex",
          "typeId": "Integer",
          "bounds": {
            "lowerBound": 1,
            "upperBound": 1
          },
          "isKey": false,
          "isReadOnly": false,
          "isUnique": false,
          "isOrdered": false,
          "constraints": [],
          "ext": {},
          "id": "a3aeda044a645de1"
        }
      ],
      "constraints": [],
      "ext": {}
    },
    {
      "kind": "Node",
      "id": "q9zvfhsvTeaC5tYJ",
      "name": "Text",
      "superTypes": ["lW611f30a2ky4276g3l8N:Z4kq1M8sV0bN2xR7pT6u"],
      "attributes": [
        {
          "name": "text",
          "typeId": "String",
          "bounds": {
            "lowerBound": 1,
            "upperBound": 1
          },
          "isKey": false,
          "isReadOnly": false,
          "isUnique": false,
          "isOrdered": false,
          "constraints": [],
          "ext": {},
          "id": "908c9abcb560c5f0"
        }
      ],
      "constraints": [],
      "ext": {}
    },
    {
      "kind": "Node",
      "id": "x0YgCFFNElWeMgzw",
      "name": "Person",
      "superTypes": ["lW611f30a2ky4276g3l8N:n7Vb2Qx0Lm9P3sT6yK1h"],
      "attributes": [
        {
          "name": "firstName",
          "typeId": "String",
          "bounds": {
            "lowerBound": 1,
            "upperBound": 1
          },
          "isKey": false,
          "isReadOnly": false,
          "isUnique": false,
          "isOrdered": false,
          "constraints": [],
          "ext": {},
          "id": "39fb9dda8d6dbbd6"
        },
        {
          "name": "lastName",
          "typeId": "String",
          "bounds": {
            "lowerBound": 1,
            "upperBound": 1
          },
          "isKey": false,
          "isReadOnly": false,
          "isUnique": false,
          "isOrdered": false,
          "constraints": [],
          "ext": {},
          "id": "0c425f759d577105"
        }
      ],
      "constraints": [],
      "ext": {}
    },
    {
      "kind": "Node",
      "id": "Dw1IOSlQJR0xI7jn",
      "name": "Place",
      "superTypes": ["lW611f30a2ky4276g3l8N:n7Vb2Qx0Lm9P3sT6yK1h"],
      "attributes": [
        {
          "name": "geoReference",
          "typeId": "String",
          "bounds": {
            "lowerBound": 0,
            "upperBound": 1
          },
          "isKey": false,
          "isReadOnly": false,
          "isUnique": false,
          "isOrdered": false,
          "constraints": [],
          "ext": {},
          "id": "9219647a5cced022"
        }
      ],
      "constraints": [],
      "ext": {}
    }
  ],
  "relations": [
    {
      "kind": "Relation",
      "id": "R1DF98Sthln8PzWc",
      "superTypes": ["lW611f30a2ky4276g3l8N:V7pQ2xL9mR0sT6yK1nB3"],
      "name": "PART_OF",
      "from": {
        "nodeId": "k1nsqV4EImkrzZ2j",
        "bounds": {
          "lowerBound": 0,
          "upperBound": -1
        },
        "constraints": [],
        "ext": {},
        "id": "655d50e9a75237ed"
      },
      "to": {
        "nodeId": "Seg0cKcMGCKmCll1",
        "bounds": {
          "lowerBound": 0,
          "upperBound": -1
        },
        "constraints": [],
        "ext": {},
        "id": "90758f5955bf7b01"
      },
      "constraints": [],
      "ext": {}
    },
    {
      "kind": "Relation",
      "id": "KcGHVw1dwxkOJ1LF",
      "superTypes": ["lW611f30a2ky4276g3l8N:V7pQ2xL9mR0sT6yK1nB3"],
      "name": "PART_OF",
      "from": {
        "nodeId": "Seg0cKcMGCKmCll1",
        "bounds": {
          "lowerBound": 0,
          "upperBound": -1
        },
        "constraints": [],
        "ext": {},
        "id": "99c4acf94a413a7e"
      },
      "to": {
        "nodeId": "Seg0cKcMGCKmCll1",
        "bounds": {
          "lowerBound": 0,
          "upperBound": -1
        },
        "constraints": [],
        "ext": {},
        "id": "eb5fb224c9e405a3"
      },
      "constraints": [],
      "ext": {}
    },
    {
      "kind": "Relation",
      "id": "rWqcImPECDxoGst9",
      "superTypes": ["lW611f30a2ky4276g3l8N:K0mT3aL7vQ9pX4sN1cDz"],
      "name": "PART_OF",
      "from": {
        "nodeId": "q9zvfhsvTeaC5tYJ",
        "bounds": {
          "lowerBound": 0,
          "upperBound": -1
        },
        "constraints": [],
        "ext": {},
        "id": "e3778223236fff05"
      },
      "to": {
        "nodeId": "k1nsqV4EImkrzZ2j",
        "bounds": {
          "lowerBound": 0,
          "upperBound": -1
        },
        "constraints": [],
        "ext": {},
        "id": "8f1537f2dfc360cb"
      },
      "constraints": [],
      "ext": {}
    },
    {
      "kind": "Relation",
      "id": "ocItrmE1Zmbe3y3M",
      "superTypes": ["lW611f30a2ky4276g3l8N:pX4sN1cDzK0mT3aL7vQ9"],
      "name": "HAS_ANNOTATION",
      "from": {
        "nodeId": "q9zvfhsvTeaC5tYJ",
        "bounds": {
          "lowerBound": 0,
          "upperBound": -1
        },
        "constraints": [],
        "ext": {},
        "id": "834fa4be720ec66a"
      },
      "to": {
        "nodeId": "qR7aST8pHEnrnUWu",
        "bounds": {
          "lowerBound": 0,
          "upperBound": -1
        },
        "constraints": [],
        "ext": {},
        "id": "9669c0eda0ccd3b2"
      },
      "constraints": [],
      "ext": {}
    },
    {
      "kind": "Relation",
      "id": "e0RHDqiZW9mPpMs6",
      "superTypes": ["lW611f30a2ky4276g3l8N:mR0sT6yK1nB3xV7pQ2xL9"],
      "name": "REFERS_TO",
      "from": {
        "nodeId": "qR7aST8pHEnrnUWu",
        "bounds": {
          "lowerBound": 0,
          "upperBound": -1
        },
        "constraints": [],
        "ext": {},
        "id": "69a35d2c2e962ab7"
      },
      "to": {
        "nodeId": "x0YgCFFNElWeMgzw",
        "bounds": {
          "lowerBound": 0,
          "upperBound": -1
        },
        "constraints": [],
        "ext": {},
        "id": "8d929e45dfbe7768"
      },
      "constraints": [],
      "ext": {}
    },
    {
      "kind": "Relation",
      "id": "XBWFqmedCGhL8qbf",
      "superTypes": ["lW611f30a2ky4276g3l8N:mR0sT6yK1nB3xV7pQ2xL9"],
      "name": "REFERS_TO",
      "from": {
        "nodeId": "qR7aST8pHEnrnUWu",
        "bounds": {
          "lowerBound": 0,
          "upperBound": -1
        },
        "constraints": [],
        "ext": {},
        "id": "125c7fbd0658b515"
      },
      "to": {
        "nodeId": "Dw1IOSlQJR0xI7jn",
        "bounds": {
          "lowerBound": 0,
          "upperBound": -1
        },
        "constraints": [],
        "ext": {},
        "id": "78e5d706517d7e34"
      },
      "constraints": [],
      "ext": {}
    }
  ],
  "ext": {}
}
